cnpj_coop,nome_coop,naturezaJuridica,classe,situacao,regimeEspecial,logradouro,complemento,bairro,municipio,uf,cep,endereco_eletronico,email,segmento_prudencial,filiacao
1439107,BARRACRED - COOPERATIVA DE ECONOMIA E CRÉDITO MÚTUO,Sociedade Cooperativa,,Autorizada em Atividade,false,"RUA ANTONIO FRANCO POMPEU, 261",,VILA OPERÁRIA,BARRA BONITA,SP,17340000,barracred@barracred.com.br,barracred@barracred.com.br,S5,
5036532,CENTRAL DAS COOPERATIVAS DE CREDITO UNICOOB - SICOOB CENTRAL UNICOOB,Sociedade Cooperativa,,Autorizada em Atividade,false,AV  DUQUE DE CAXIAS  N  882  SOBRELOJA 2,EDIFICIO NEW TOWER PLAZA,NOVO CENTRO,MARINGA,PR,87020025,diretoria@sicoobpr.com.br,diretoria@sicoobpr.com.br,S4,
62931522,CENTRAL DAS COOPERATIVAS DE CRÉDITO DO ESTADO DE SÃO PAULO - SICOOB CENTRAL CECRESP,Sociedade Cooperativa,,Autorizada em Atividade,false,PRACA ALFREDO ISSA  48,18 ANDAR   CJS  181 182,SANTA EFIGENIA,SAO PAULO,SP,01033040,administracao@cecresp.org.br,administracao@cecresp.org.br,S4,
70116611,CENTRAL DAS COOPERATIVAS DE CRÉDITO DO NORDESTE - SICOOB CENTRAL NE,Sociedade Cooperativa,,Autorizada em Atividade,false,RUA EMPRESARIO CLOVIS ROLIM  N 2051,ED  DCT   DUO CORPORATE TOWERS  16  ANDAR  TORRE B,DOS IPES,JOAO PESSOA,PB,58028873,central@sicoobne.com.br,central@sicoobne.com.br,S4,
106180,"CENTRAL DAS COOPERATIVAS DE CRÉDITO DOS ESTADOS DE MATO GROSSO, MATO GROSSO DO SUL E DO MUNICÍPIO DE CACOAL/RO - SICOOB CENTRAL RONDON",Sociedade Cooperativa,,Autorizada em Atividade,false,RUA I  185,PARQUE ELDORADO,JARDIM ALVORADA,CUIABA,MT,78048487,central@sicoobmtms.coop.br,central@sicoobmtms.coop.br,S4,
309024,CENTRAL DAS COOPERATIVAS DE ECONOMIA E CREDITO DO ESTADO DE MINAS GERAIS LTDA. - SICOOB CENTRAL CECREMGE,Sociedade Cooperativa,,Autorizada em Atividade,false,AV  DO CONTORNO  N 4924   3   5  E 6  ANDARES,,FUNCIONARIOS,BELO HORIZONTE,MG,30110032,cecremge@cecremge.org.br,cecremge@cecremge.org.br,S4,
4243780,CENTRAL SICOOB UNI DE COOPERATIVAS DE CRÉDITO,Sociedade Cooperativa,,Autorizada em Atividade,false,AVENIDA REPUBLICA DO LIBANO,N  936   1  ANDAR,SETOR AEROPORTO,GOIANIA,GO,74070040,unicredbc@unicredsys.com.br,unicredbc@unicredsys.com.br,S4,
3795072,CONFEDERACAO DAS COOPERATIVAS DO SICREDI - CONFEDERACAO SICREDI,Sociedade Cooperativa,,,false,"AV. ASSIS BRASIL, 3940",6. ANDAR,JARDIM LINDOIA,PORTO ALEGRE,RS,91010003,confederacao_unicad@sicredi.com.br,confederacao_unicad@sicredi.com.br,,
4891850,CONFEDERACAO NACIONAL DAS COOPERATIVAS DO SICOOB LTDA,Sociedade Cooperativa,,,false,SIG QUADRA 06 LOTE 2080 TORRE II,CENTRO CORPORATIVO SICOOB,SIG,BRASILIA,DF,70610460,sicoob-brasil@sicoob-brasil.com.br,sicoob-brasil@sicoob-brasil.com.br,,
10398952,CONFEDERAÇÃO NACIONAL DAS COOPERATIVAS CENTRAIS DE CRÉDITO E ECONOMIA FAMILIAR E SOLIDÁRIA - CRESOL CONFEDERAÇÃO,Sociedade Cooperativa,,Autorizada em Atividade,false,RODOVIA JOSE CARLOS DAUX  N  500,2  ANDAR   CONDOMINIO TECHNO TOWERS  TORRE 1,JOAO PAULO,FLORIANOPOLIS,SC,88030000,,,S4,
315557,CONFEDERAÇÃO NACIONAL DAS COOPERATIVAS CENTRAIS UNICRED LTDA. - UNICRED DO BRASIL.,Sociedade Cooperativa,,Autorizada em Atividade,false,RUA BELA CINTRA  967,8  ANDAR   CJ  82,CONSOLACAO,SAO PAULO,SP,01415907,unicredbr@unicred.com.br,unicredbr@unicred.com.br,S4,
44469161,COOPECREDI GUARIBA - COOPERATIVA DE CREDITO,Sociedade Cooperativa,,Autorizada em Atividade,false,AV ANTONIO ALBINO 1671,,VILA GARAVELLO,GUARIBA,SP,14840000,coopecredi@coopecredi.com.br,coopecredi@coopecredi.com.br,S4,
88325113,COOPERATIVA    DE    ECONOMIA    E    CRÉDITO   MÚTUO  MINUANO,Sociedade Cooperativa,,Autorizada em Atividade,false,RUA GONCALVES DIAS  88,SALA 1005,CENTRO,CANOAS,RS,92010050,marlise@cooperativaminuano.com.br,marlise@cooperativaminuano.com.br,S5,
1664968,COOPERATIVA  DE CRÉDITO DE LIVRE ADMISSÃO DE ASSOCIADOS UNIRONDÔNIA LTDA,Sociedade Cooperativa,,Autorizada em Atividade,false,AVENIDA CALAMA 2468,,SAO JOAO BOSCO,PORTO VELHO,RO,76803769,unicredpvh@unicredportovelho.com.br,unicredpvh@unicredportovelho.com.br,S5,
1864151,COOPERATIVA  ECONOMIA CRÉDITO MÚTUO  SERVS E EMPREGADOS PÚBLICOS MUNIC DE BELO HORIZONTE BETIM BRUMADINHO CONTAGEM IBIRITÉ NOVA LIMA RIBEIRÃO DAS NEVES SABARÁ SANTA LUZIA E VESPASIANO SICOOB CREDISERV,Sociedade Cooperativa,,Autorizada em Atividade,false,RUA DA BAHIA  905   11 ANDAR,,CENTRO,BELO HORIZONTE,MG,30160011,crediservbh@crediservbh.com.br,crediservbh@crediservbh.com.br,S5,
32428294,COOPERATIVA CENTRAL DE CREDITO DO ESPIRITO SANTO - SICOOB CENTRAL ES,Sociedade Cooperativa,,Autorizada em Atividade,false,"RUA CONSTANTE SODRÉ, N- 305",,SANTA LUCIA,VITORIA,ES,29056310,sicoobes@sicoobes.com.br,sicoobes@sicoobes.com.br,S4,
5463212,COOPERATIVA CENTRAL DE CRÉDITO - AILOS,Sociedade Cooperativa,,Autorizada em Atividade,false,"RUA GENERAL OSÓRIO, 1180",,VELHA,BLUMENAU,SC,89041002,cecred@cecred.coop.br,cecred@cecred.coop.br,S4,
1401771,COOPERATIVA CENTRAL DE CRÉDITO COM INTERAÇÃO SOLIDÁRIA - CENTRAL CRESOL BASER,Sociedade Cooperativa,,Autorizada em Atividade,false,"RUA ERNESTO SANDERSON, N- 101",,INDUSTRIAL,FRANCISCO BELTRAO,PR,85601657,baser@cresol.com.br,baser@cresol.com.br,S4,
10013534,COOPERATIVA CENTRAL DE CRÉDITO COM INTERAÇÃO SOLIDÁRIA - CENTRAL CRESOL NORDESTE,Sociedade Cooperativa,,Autorizada em Atividade,false,AVENIDA SANTOS DUMONT,"SALA 608, EDIFÍCIO EMPRESARIAL REFRAN",CENTRO,LAURO DE FREITAS,BA,42705400,diretoria@ascoobcentral.com.br,diretoria@ascoobcentral.com.br,S4,
34148882,COOPERATIVA CENTRAL DE CRÉDITO DA BAHIA LTDA - SICOOB CENTRAL BA,Sociedade Cooperativa,,Autorizada em Atividade,false,RUA ALCEU AMOROSO LIMA  N  470,ED  EMPRESARIAL NIEMEYER  10  ANDAR,CAMINHO DAS ARVORES,SALVADOR,BA,41820770,sicoob-ba@sicoob-ba.com.br,sicoob-ba@sicoob-ba.com.br,S4,
33416108,"COOPERATIVA CENTRAL DE CRÉDITO DE GOIÁS, DISTRITO FEDERAL E TOCANTINS LTDA. - SICOOB NOVA CENTRAL",Sociedade Cooperativa,,Autorizada em Atividade,false,RUA 15 1250,,SETOR MARISTA,GOIANIA,GO,74150020,central@sicoobgoias.com.br,central@sicoobgoias.com.br,S4,
25683434,COOPERATIVA CENTRAL DE CRÉDITO DE MINAS GERAIS LTDA. - SICOOB CENTRAL CREDIMINAS,Sociedade Cooperativa,,Autorizada em Atividade,false,AVENIDA DEL REY  111,CONDOMINIO COMERCIAL CAICARA  TORRE B  7  ANDAR,CAPARAO,BELO HORIZONTE,MG,30775240,seger@crediminas.com.br,seger@crediminas.com.br,S3,
80160260,COOPERATIVA CENTRAL DE CRÉDITO DE SANTA CATARINA E RIO GRANDE DO SUL - SICOOB CENTRAL SC/RS,Sociedade Cooperativa,,Autorizada em Atividade,false,RUA TENENTE SILVEIRA  94,ANDARES 2   3   4   5   6   7  E 8,CENTRO,FLORIANOPOLIS,SC,88010300,sicoobsc@sicoobsc.com.br,sicoobsc@sicoobsc.com.br,S3,
63917579,COOPERATIVA CENTRAL DE CRÉDITO DO ESTADO DE SÃO PAULO - SICOOB SÃO PAULO,Sociedade Cooperativa,,Autorizada em Atividade,false,AVENIDA PROFESSOR JOAO FIUSA  2604,,JARDIM CANADA,RIBEIRAO PRETO,SP,14024260,presidencia@sicoobsp.coop.br,presidencia@sicoobsp.coop.br,S3,
3502131,COOPERATIVA CENTRAL DE CRÉDITO DO NORTE DO BRASIL - SICOOB NORTE,Sociedade Cooperativa,,Autorizada em Atividade,false,AV NACOES UNIDAS 555,,N S  DAS GRACAS,PORTO VELHO,RO,76804175,centralnorte@centralnorte.com.br,centralnorte@centralnorte.com.br,S4,
7202627,COOPERATIVA CENTRAL DE CRÉDITO E ECONOMIA COM INTERAÇÃO SOLIDÁRIA - CRESOL CENTRAL BRASIL,Sociedade Cooperativa,,Autorizada em Atividade,false,RUA ACHILES TOMAZELLI  1310E,PREDIO,SANTA MARIA,CHAPECO,SC,89812143,jonas@cresolcentral.com.br,jonas@cresolcentral.com.br,S4,
21198087,COOPERATIVA CENTRAL DE CRÉDITO E INVESTIMENTO COM INTERAÇÃO SOLIDÁRIA - CENTRAL CRESOL SICOPER,Sociedade Cooperativa,,Autorizada em Atividade,false,RUA DOUTOR BOZANO,272,PETROPOLIS,PASSO FUNDO,RS,99051370,,,S4,
543968,COOPERATIVA CENTRAL DE CRÉDITO UNICRED CONEXÃO LTDA - UNICRED CENTRAL CONEXÃO,Sociedade Cooperativa,,Autorizada em Atividade,false,RUA CRISTOVAO NUNES PIRES 50 TORRE NORDEN,LJ 05  SALAS 402 403 508 509 510 E 511,CENTRO,FLORIANOPOLIS,SC,88010120,administracao@unicredcentralsc.com.br,administracao@unicredcentralsc.com.br,S4,
1634601,COOPERATIVA CENTRAL DE CRÉDITO UNICRED GERAÇÃO LTDA. - UNICRED CENTRAL GERAÇÃO,Sociedade Cooperativa,,Autorizada em Atividade,false,AVENIDA PRAIA DE BELAS  1212,TORRE NORTE  8  ANDAR,PRAIA DE BELAS,PORTO ALEGRE,RS,90110000,angela@unicred-rs.com.br,angela@unicred-rs.com.br,S4,
33737818,"COOPERATIVA CENTRAL DE CRÉDITO, POUPANÇA E INVESTIMENTO DE MATO GROSSO DO SUL, GOIÁS, DISTRITO FEDERAL E TOCANTINS - CENTRAL SICREDI BRASIL CENTRAL",Sociedade Cooperativa,,Autorizada em Atividade,false,AV  T 12  S N,QD 123 LT 17 18 SALA 2801 ED CONNECT PARK BUSINESS,BUENO,GOIANIA,GO,74223080,centralms_bacen@sicredi.com.br,centralms_bacen@sicredi.com.br,S4,
33667205,"COOPERATIVA CENTRAL DE CRÉDITO, POUPANÇA E INVESTIMENTO DO CENTRO NORTE DO BRASIL - CENTRAL SICREDI CENTRO NORTE",Sociedade Cooperativa,,Autorizada em Atividade,false,AV  JOSE RODRIGUES DO PRADO  19,1  ANDAR,SANTA ROSA,CUIABA,MT,78040000,nauder_silva@sicredi.com.br,nauder_silva@sicredi.com.br,S4,
70119680,"COOPERATIVA CENTRAL DE CRÉDITO, POUPANÇA E INVESTIMENTO DO NORDESTE - CENTRAL SICREDI NORDESTE",Sociedade Cooperativa,,Autorizada em Atividade,false,AV. PRESIDENTE EPITÁCIO PESSOA,19- ANDAR - EDIFÍCIO ATLANTIS OFFICES DESIGN,TAMBAUZINHO,JOAO PESSOA,PB,0058042006,unicred@unicrednne.com.br,unicred@unicrednne.com.br,S4,
87437687,"COOPERATIVA CENTRAL DE CRÉDITO, POUPANÇA E INVESTIMENTO DO SUL E SUDESTE - CENTRAL SICREDI SUL/SUDESTE",Sociedade Cooperativa,,Autorizada em Atividade,false,"R. MANOELITO DE ORNELLAS, 55",18- E 19- ANDAR,PRAIA DE BELAS,PORTO ALEGRE,RS,90110230,centralsul_juridico@sicredi.com.br,centralsul_juridico@sicredi.com.br,S3,
80230774,"COOPERATIVA CENTRAL DE CRÉDITO, POUPANÇA E INVESTIMENTO DOS ESTADOS DO PARANÁ, SÃO PAULO E RIO DE JANEIRO - CENTRAL SICREDI PR/SP/RJ",Sociedade Cooperativa,,Autorizada em Atividade,false,R ALCIDES MUNHOZ  165,1  ANDAR,MERCES,CURITIBA,PR,80810040,centralpr_juridico@sicredi.com.br,centralpr_juridico@sicredi.com.br,S3,
86774775,COOPERATIVA CENTRAL DE ECONOMIA E CRÉDITO MÚTUO DAS UNICREDS DO ESTADO DO RIO DE JANEIRO E DO MATO GROSSO LTDA   UNICRED CENTRAL RJ/MT,Sociedade Cooperativa,,Autorizada em Atividade,false,RUA DO OUVIDOR 121,SALA 2101,CENTRO,RIO DE JANEIRO,RJ,20040031,superincentral@unicred-rj.com.br,superincentral@unicred-rj.com.br,S4,
14568725,COOPERATIVA CENTRAL DE ECONOMIA E CRÉDITO SICOOB UNIMAIS RIO LTDA.,Sociedade Cooperativa,,Autorizada em Atividade,false,RUA RODRIGO SILVA  N  26,6  ANDAR   SALA 601,CENTRO,RIO DE JANEIRO,RJ,20011040,,,S4,
51010858,COOPERATIVA DE CAPITAL E EMPRÉSTIMO COOPERMULTICRED - COOPERMC,Sociedade Cooperativa,,Autorizada em Atividade,false,AV  MONTEIRO LOBATO  3411   ANTIGO 3285,HITACHI PG   SETOR  COOPERATIVA,SAO ROQUE,GUARULHOS,SP,07190904,cooperativa.marcos-silva@br.abb.com,cooperativa.marcos-silva@br.abb.com,S5,
54603022,COOPERATIVA DE CREDITO CECRES - SICOOB CECRES,Sociedade Cooperativa,,Autorizada em Atividade,false,AV IPIRANGA  324,BL C EDF  INVESTIMENTO 1  3  E 15  ANDAR,REPUBLICA,SAO PAULO,SP,01046010,contab@cecres.com.br,contab@cecres.com.br,S5,
4120633,COOPERATIVA DE CREDITO CLASSICA DO ESTADO DO RIO DE JANEIRO - SICOOB EMPRESAS RJ,Sociedade Cooperativa,,Autorizada em Atividade,false,AV  DAS AMERICAS  3500  BLOCO 2  SALA 204,COND  LE MONDE,BARRA DA TIJUCA,RIO DE JANEIRO,RJ,22640102,infocrerj@infocrerj.com.br,infocrerj@infocrerj.com.br,S5,
49389307,COOPERATIVA DE CREDITO COOPLIVRE,Sociedade Cooperativa,,Autorizada em Atividade,false,RUA BENTO DIAS  608,,CENTRO,CAPIVARI,SP,13360000,rural@credicap.com.br,rural@credicap.com.br,S5,
429890,COOPERATIVA DE CREDITO CREDIAGRO LTDA. - SICOOB CREDIAGRO,Sociedade Cooperativa,,Autorizada em Atividade,false,RUA TIRADENTES,440,CENTRO,CAMPOS ALTOS,MG,38970000,campal310300@sicoobcrediminas.com.br,campal310300@sicoobcrediminas.com.br,S5,
966246,COOPERATIVA DE CREDITO CREDICERIPA - SICOOB CREDICERIPA,Sociedade Cooperativa,,Autorizada em Atividade,false,RUA SALVADOR DE FREITAS N 1 243,,CENTRO,ITAI,SP,18730000,roseli@crediceripa.com.br,roseli@crediceripa.com.br,S4,
54037916,COOPERATIVA DE CREDITO CREDICITRUS,Sociedade Cooperativa,,Autorizada em Atividade,false,RUA PRUDENTE DE MORAES  534,,CENTRO,BEBEDOURO,SP,14700120,administracao@credicitrus.com.br,administracao@credicitrus.com.br,S3,
66788142,COOPERATIVA DE CREDITO CREDIMOTA   SICOOB CREDIMOTA,Sociedade Cooperativa,,Autorizada em Atividade,false,RUA HENRIQUE VASQUES  262,,CENTRO,CANDIDO MOTA,SP,19880000,administrativo@credimota.com.br,administrativo@credimota.com.br,S5,
3358914,COOPERATIVA DE CREDITO CREDIROCHAS - SICOOB CREDIROCHAS,Sociedade Cooperativa,,Autorizada em Atividade,false,"RUA VINTE E CINCO DE MARÇO, N- 29",,CENTRO,CACHOEIRO DE ITAPEMIRIM,ES,29300100,credirochas@sicoobes.com.br,credirochas@sicoobes.com.br,S5,
22656789,COOPERATIVA DE CREDITO CREDISUDESTE LTDA. - SICOOB CREDISUDESTE,Sociedade Cooperativa,,Autorizada em Atividade,false,R PASCHOAL BERNARDINO  101,,CENTRO,MURIAE,MG,36880049,esfeliz311800@sicoobcrediminas.com.br,esfeliz311800@sicoobcrediminas.com.br,S5,
5463934,COOPERATIVA DE CREDITO CREDLIDER - SICOOB CREDLIDER,Sociedade Cooperativa,,Autorizada em Atividade,false,RUA SAO PAULO  3069,TERREO,CENTRO,VOTUPORANGA,SP,15500010,credlider@credlider.coop.br,credlider@credlider.coop.br,S5,
1009908,COOPERATIVA DE CREDITO DE LIVRE ADMISSAO DE PARA DE MINAS LTDA - SICOOB ASCICRED,Sociedade Cooperativa,,Autorizada em Atividade,false,RUA BENEDITO VALADARES 51,,CENTRO,PARA DE MINAS,MG,35660630,ascicred@ascicred.com.br,ascicred@ascicred.com.br,S5,
4181542,COOPERATIVA DE CREDITO DE LIVRE ADMISSAO DE PITANGUI E REGIAO LTDA. - SICOOB CREDPIT,Sociedade Cooperativa,,Autorizada em Atividade,false,AV  LIMA GUIMARAES  39,,CENTRO,PITANGUI,MG,35650000,credpit@credpit.com.br,credpit@credpit.com.br,S5,
73422792,COOPERATIVA DE CREDITO DE LIVRE ADMISSAO DE RUBIATABA E REGIAO LTDA,Sociedade Cooperativa,,Autorizada em Atividade,false,"AV. AROEIRA, 880",,SETOR AEROPORTO,RUBIATABA,GO,76350000,rubiataba@sicoobrubiataba.com.br,rubiataba@sicoobrubiataba.com.br,S5,
2173447,COOPERATIVA DE CREDITO DE LIVRE ADMISSAO DO CENTRO NORDESTE MINEIRO LTDA - SICOOB CREDICENM,Sociedade Cooperativa,,Autorizada em Atividade,false,PRACA JK 333,,CENTRO,GUANHAES,MG,39740000,credicenm@credicenm.com.br,credicenm@credicenm.com.br,S5,
19869338,COOPERATIVA DE CREDITO DE LIVRE ADMISSAO DO VALE DO AÇO LTDA - SICOOB VALE DO AÇO,Sociedade Cooperativa,,Autorizada em Atividade,false,AV  CASTELO BRANCO  582,A,HORTO,IPATINGA,MG,35160294,sicoobvaledoaco@sicoobvaledoaco.com.br,sicoobvaledoaco@sicoobvaledoaco.com.br,S5,
42887133,COOPERATIVA DE CREDITO DE LIVRE ADMISSÃO DA REGIÃO SUDESTE DE MINAS GERAIS LTDA. - SICOOB CREDISUCESSO,Sociedade Cooperativa,,Autorizada em Atividade,false,PRACA BENJAMIM GUIMARAES,109,CENTRO,BOM SUCESSO,MG,37220000,bsucesso310000@sicoobcrediminas.com.br,bsucesso310000@sicoobcrediminas.com.br,S5,
81014060,COOPERATIVA DE CREDITO DE LIVRE ADMISSÃO DE ASSOCIADOS ITAIPU SICOOB CREDITAIPU,Sociedade Cooperativa,,Autorizada em Atividade,false,RUA JOAO PESSOA  1 490,CENTRO,CENTRO,PINHALZINHO,SC,89870000,carlos@creditaipu.com.br,carlos@creditaipu.com.br,S5,
64480833,COOPERATIVA DE CREDITO DE LIVRE ADMISSÃO DE MARTINHO CAMPOS LTDA - SICOOB CREDIMAC,Sociedade Cooperativa,,Autorizada em Atividade,false,"PRACA GOVERNADOR VALADARES, 142",,CENTRO,MARTINHO CAMPOS,MG,35606000,mcampos314100@sicoobcrediminas.com.br,mcampos314100@sicoobcrediminas.com.br,S5,
1604998,COOPERATIVA DE CREDITO DE LIVRE ADMISSÃO DO SUL DE MINAS LTDA - SICOOB CREDIVASS,Sociedade Cooperativa,,Autorizada em Atividade,false,RUA DR  FERNANDO LEMOS  45,,CENTRO,SAO GONCALO DO SAPUCAI,MG,37490000,sgsapucai316900@sicoobcrediminas.com.br,sgsapucai316900@sicoobcrediminas.com.br,S5,
25404542,COOPERATIVA DE CREDITO DE LIVRE ADMISSÃO DO VALE DO GORUTUBA LTDA - SICOOB CREDIVAG,Sociedade Cooperativa,,Autorizada em Atividade,false,AV  MANOEL ATHAIDE,713   1 ANDAR,CENTRO,JANAUBA,MG,39440000,janauba313400@sicoobcrediminas.com.br,janauba313400@sicoobcrediminas.com.br,S5,
968602,COOPERATIVA DE CREDITO DE LIVRE ADMISSÃO DO VALE DO SÃO PATRICIO LTDA.,Sociedade Cooperativa,,Autorizada em Atividade,false,AV  BRASIL N  330,,CENTRO,GOIANESIA,GO,76380070,coopercred@sicoobgoias.com.br,coopercred@sicoobgoias.com.br,S5,
25387671,COOPERATIVA DE CREDITO DO ALTO PARANAIBA E REGIÃO LTDA. - SICOOB CREDIPATOS,Sociedade Cooperativa,,Autorizada em Atividade,false,RUA MAJOR GOTE,1699,CENTRO,PATOS DE MINAS,MG,38700001,patominas315400@sicoobcrediminas.com.br,patominas315400@sicoobcrediminas.com.br,S5,
8044854,COOPERATIVA DE CREDITO DO CENTRO DO ESTADO DE RONDONIA - SICOOB CENTRO,Sociedade Cooperativa,,Autorizada em Atividade,false,"RUA MANOEL FRANCO, 1050",,NOVA BRASILIA,JI-PARANA,RO,76908442,graeffegraeff@uol.com.br,graeffegraeff@uol.com.br,S5,
14913919,COOPERATIVA DE CREDITO DO MERCADO IMOBILIÁRIO - SICOOB IMOB.VC,Sociedade Cooperativa,,Autorizada em Atividade,false,RUA SERGIPE  1000,,SAVASSI,BELO HORIZONTE,MG,30130174,,,S5,
3033469,COOPERATIVA DE CREDITO DO PLANALTO SUL - SICOOB CREDISSERRANA,Sociedade Cooperativa,,Autorizada em Atividade,false,AV  LUIZ DE CAMOES 243,,CORAL,LAGES,SC,88523000,credisserrana@iscc.com.br,credisserrana@iscc.com.br,S5,
53776852,COOPERATIVA DE CREDITO DOS FORNECEDORES DE CANA E DEMAIS PRODUTORES RURAIS DO CENTRO DO ESTADO DE SAO PAULO - CREDICENTRO,Sociedade Cooperativa,,Autorizada em Atividade,false,"AVENIDA CIENTISTA FREDERICO DE MARCO, 21",,VILA XAVIER,ARARAQUARA,SP,14810185,credi-centro@uol.com.br,credi-centro@uol.com.br,S5,
27302181,COOPERATIVA DE CREDITO DOS SERVIDORES DA UNIVERSIDADE FEDERAL DO ESPIRITO SANTO,Sociedade Cooperativa,,Autorizada em Atividade,false,AV  MARECHAL CAMPOS  1355,,SANTA CECILIA,VITORIA,ES,29043260,credufes@credufes.coop.br,credufes@credufes.coop.br,S5,
4281182,COOPERATIVA DE CREDITO E ECONOMIA COM INTERACAO SOLIDARIA DE CHAPECO - CRESOL CHAPECO,Sociedade Cooperativa,,Autorizada em Atividade,false,AV  PORTO ALEGRE  223,E   SALAS 101  201  303 E 403,CENTRO,CHAPECO,SC,89802132,chapeco@cresolcentral.com.br,chapeco@cresolcentral.com.br,S5,
5410056,COOPERATIVA DE CREDITO E ECONOMIA COM INTERAÇÃO SOLIDARIA - CRESOL LITORAL,Sociedade Cooperativa,,Autorizada em Atividade,false,AVENIDA DUQUE DE CAXIAS 378,,CENTRO,JAGUARUNA,SC,88715000,jaguaruna@cresolcentral.com.br,jaguaruna@cresolcentral.com.br,S5,
9488496,COOPERATIVA DE CREDITO E ECONOMIA COM INTERAÇÃO SOLIDARIA - CRESOL SÃO JOÃO DO SUL,Sociedade Cooperativa,,Autorizada em Atividade,false,RUA ANSELMO BORBA  N  406,SALA 02,CENTRO,SAO JOAO DO SUL,SC,88970000,saojoaodosul@cresolcentral.com.br,saojoaodosul@cresolcentral.com.br,S5,
9463721,COOPERATIVA DE CREDITO E ECONOMIA COM INTERAÇÃO SOLIDÁRIA - CRESOL JACINTO MACHADO,Sociedade Cooperativa,,Autorizada em Atividade,false,RUA POOL JORGE ZACCA  N  135,,CENTRO,JACINTO MACHADO,SC,88950000,jacintomachado@cresolcentral.com.br,jacintomachado@cresolcentral.com.br,S5,
7958405,COOPERATIVA DE CREDITO E ECONOMIA COM INTERAÇÃO SOLIDÁRIA - CRESOL SERRA MAR,Sociedade Cooperativa,,Autorizada em Atividade,false,RUA JORGE LACERDA  294,SALA 01,CENTRO,RIO FORTUNA,SC,88760000,riofortuna@cresolcentral.com.br,riofortuna@cresolcentral.com.br,S5,
9330158,COOPERATIVA DE CREDITO E ECONOMIA COM INTERAÇÃO SOLIDÁRIA - CRESOL TREZE DE MAIO,Sociedade Cooperativa,,Autorizada em Atividade,false,RUA OLINDO NANDI  70,,CENTRO,TREZE DE MAIO,SC,88710000,trezedemaio@cresolcentral.com.br,trezedemaio@cresolcentral.com.br,S5,
971300,COOPERATIVA DE CREDITO E INVESTIMENTO COM INTERACAO SOLIDARIA PIONEIRA - CRESOL PIONEIRA,Sociedade Cooperativa,,Autorizada em Atividade,false,AVENIDA 28 DE NOVEMBRO  71,CENTRO,CENTRO,DOIS VIZINHOS,PR,85660000,doisvizinhos@cresol.com.br,doisvizinhos@cresol.com.br,S5,
59869560,COOPERATIVA DE CREDITO NOSSO - SICOOB NOSSO,Sociedade Cooperativa,,Autorizada em Atividade,false,AL  DR  ARMANDO SALLES DE OLIVEIRA  N  446,,CENTRO,ADAMANTINA,SP,17800000,cocrealpa@cocrealpa.com.br,cocrealpa@cocrealpa.com.br,S5,
2382755,COOPERATIVA DE CREDITO POTIGUAR - SICOOB POTIGUAR,Sociedade Cooperativa,,Autorizada em Atividade,false,TRAVESSA DOIS DE NOVEMBRO  430,,ALECRIM,NATAL,RN,59030170,credipol@terra.com.br,credipol@terra.com.br,S5,
63229629,COOPERATIVA DE CREDITO RURAL ASCOOB SISAL,Sociedade Cooperativa,,Autorizada em Atividade,false,"AV. MANOEL NOVAIS, 485",,CENTRO,SERRINHA,BA,48700000,serrinha@ascoobcentral.com.br,serrinha@ascoobcentral.com.br,S5,
32422628,COOPERATIVA DE CREDITO RURAL DE GUACUI - CREDIGUAÇUÍ,Sociedade Cooperativa,,Autorizada em Atividade,false,"RUA BOM JESUS DO LIVRAMENTO, 25",,CENTRO,GUACUI,ES,29560000,coopcredi@yahoo.com.br,coopcredi@yahoo.com.br,S5,
8240446,COOPERATIVA DE CREDITO RURAL DE IBIAM - SULCREDI/IBIAM,Sociedade Cooperativa,,Autorizada em Atividade,false,AVENIDA 20 DE JULHO,830,CENTRO,IBIAM,SC,89652000,ibiam@cresol.com.br,ibiam@cresol.com.br,S5,
204963,COOPERATIVA DE CREDITO RURAL SEARA - CREDISEARA,Sociedade Cooperativa,,Autorizada em Atividade,false,AVENIDA BEIRA RIO 06,,CENTRO,SEARA,SC,89770000,seara@cresolcentral.com.br,seara@cresolcentral.com.br,S5,
32615247,COOPERATIVA DE CREDITO SICOOB COOPEC LTDA.,Sociedade Cooperativa,,Autorizada em Atividade,false,AVENIDA DO CINQUENTENaRIO,1  E 2  ANDAR,CENTRO,ITABUNA,BA,45600006,coopec@ceplac.gov.br,coopec@ceplac.gov.br,S5,
82639451,COOPERATIVA DE CREDITO VALE DO ITAJAI - VIACREDI,Sociedade Cooperativa,,Autorizada em Atividade,false,"RUA HERMANN HERING,1125",,BOM RETIRO,BLUMENAU,SC,89010675,viacredi@viacredi.coop.br,viacredi@viacredi.coop.br,S3,
72128440,"COOPERATIVA DE CREDITO, POUPANCA E INVESTIMENTO DO RIO DE JANEIRO - SICREDI RIO RJ",Sociedade Cooperativa,,Autorizada em Atividade,false,RUA SOROCABA  500,,BOTAFOGO,RIO DE JANEIRO,RJ,22271110,contabilidade@unicredrio.com.br,contabilidade@unicredrio.com.br,S4,
84974278,"COOPERATIVA DE CREDITO, POUPANCA E INVESTIMENTO IGUACU - SICREDI IGUACU PR/SC/SP",Sociedade Cooperativa,,Autorizada em Atividade,false,AV  XV DE NOVEMBRO  374,PREDIO 2 PISOS,CENTRO,SAO JOAO,PR,85570000,coop0740_iguacu@sicredi.com.br,coop0740_iguacu@sicredi.com.br,S4,
79052122,"COOPERATIVA DE CREDITO, POUPANÇA E INVESTIMENTO ALIANÇA - SICREDI ALIANÇA PR/SP",Sociedade Cooperativa,,Autorizada em Atividade,false,R ESPIRITO SANTO  991,,CENTRO,MARECHAL CANDIDO RONDON,PR,85960000,coop0715_coeste@sicredi.com.br,coop0715_coeste@sicredi.com.br,S4,
82065285,"COOPERATIVA DE CREDITO, POUPANÇA E INVESTIMENTO PARQUE DAS ARAUCARIAS - SICREDI PARQUE DAS ARAUCARIAS PR/SC/SP",Sociedade Cooperativa,,Autorizada em Atividade,false,AV  BRASIL  N  543,,CENTRO,MARIOPOLIS,PR,85525000,coop0737_scristovao@sicredi.com.br,coop0737_scristovao@sicredi.com.br,S4,
3612764,COOPERATIVA DE CRÉDITO  DE FRONTEIRAS  LTDA. - SICOOB FRONTEIRAS,Sociedade Cooperativa,,Autorizada em Atividade,false,RUA SAO LUIZ  1230,,CENTRO,CACOAL,RO,76973884,credicacoal@nettravel.com.br,credicacoal@nettravel.com.br,S5,
5545390,COOPERATIVA DE CRÉDITO - SICREDI COOMAMP,Sociedade Cooperativa,,Autorizada em Atividade,false,RUA DOS AZULOES 1,EDIFICIO OFFICE TOWER  SALAS 720 723,JARDIM RENASCENCA,SAO LUIS,MA,65075060,coomamp@yahoo.com.br,coomamp@yahoo.com.br,S5,
70038237,COOPERATIVA DE CRÉDITO - SICREDI RIO GRANDE DO NORTE,Sociedade Cooperativa,,Autorizada em Atividade,false,RUA TUIUTI  765,,PETROPOLIS,NATAL,RN,59014160,controladoria@unicrednatal.com.br,controladoria@unicrednatal.com.br,S5,
42873828,COOPERATIVA DE CRÉDITO AGROCREDI LTDA. - SICOOB AGROCREDI,Sociedade Cooperativa,,Autorizada em Atividade,false,RUA CAPITAO JOAQUIM NORBERTO,105 E 129,CENTRO,GUAXUPE,MG,37800000,guaxupe312500@sicoobcrediminas.com.br,guaxupe312500@sicoobcrediminas.com.br,S4,
87795639,COOPERATIVA DE CRÉDITO ALIANÇA RS/SC/ES - SICREDI ALIANÇA RS/SC/ES,Sociedade Cooperativa,,Autorizada em Atividade,false,RUA GUSTAVO SILVEIRA FERRET  124,,SANTA LUCIA,MARAU,RS,99150000,evandro_zilli@sicredi.com.br,evandro_zilli@sicredi.com.br,S4,
80959612,COOPERATIVA DE CRÉDITO ALTO VALE DO ITAJAÍ - SICOOB ALTO VALE,Sociedade Cooperativa,,Autorizada em Atividade,false,RUA WENCESLAU BORINI  890,SALA 01,CANTA GALO,RIO DO SUL,SC,89163152,credicravil@credicravil.com.br,credicravil@credicravil.com.br,S5,
3320525,COOPERATIVA DE CRÉDITO ARACOOP LTDA. - SICOOB ARACOOP,Sociedade Cooperativa,,Autorizada em Atividade,false,RUA PADRE NORBERTO  N 390,,JARDIM REGINA,ARAGUARI,MG,38440148,aracoop@uol.com.br,aracoop@uol.com.br,S5,
68987,COOPERATIVA DE CRÉDITO ARACREDI LTDA. - SICOOB ARACREDI,Sociedade Cooperativa,,Autorizada em Atividade,false,RUA MAJOR JOAQUIM MAGALHÃES,303,CENTRO,ARAGUARI,MG,38440152,araguari309300@sicoobcrediminas.com.br,araguari309300@sicoobcrediminas.com.br,S5,
41753500,COOPERATIVA DE CRÉDITO CARLOS CHAGAS LTDA. - SICOOB CARLOS CHAGAS,Sociedade Cooperativa,,Autorizada em Atividade,false,AV  CAPITAO JOAO PINTO 17,B,CENTRO,CARLOS CHAGAS,MG,39864000,diretoria304500@sicoobcrediminas.com.br,diretoria304500@sicoobcrediminas.com.br,S5,
88471024,COOPERATIVA DE CRÉDITO CENTRO LESTE - SICREDI CENTRO LESTE RS,Sociedade Cooperativa,,Autorizada em Atividade,false,RUA SALDANHA MARINHO  825,,CENTRO,CACHOEIRA DO SUL,RS,96508001,,,S4,
9403026,COOPERATIVA DE CRÉDITO CENTRO LESTE NORTE MARANHENSE - SICOOB CENTROLESTE,Sociedade Cooperativa,,Autorizada em Atividade,false,PRACA RAIMUNDO SIMAS  55,,CENTRO,GRAJAU,MA,65940000,credisul-ma@sicoobne.com.br,credisul-ma@sicoobne.com.br,S5,
33924028,COOPERATIVA DE CRÉDITO CLÁSSICA DOS EMPREGADOS DA VALE S/A E ENTIDADES VINCULADAS LTDA. - SICOOB COOPVALE,Sociedade Cooperativa,,Autorizada em Atividade,false,"RUA SANTA LUZIA, 651",35- ANDAR,CENTRO,RIO DE JANEIRO,RJ,20030041,coopvale@coopvale.com.br,coopvale@coopvale.com.br,S5,
21110927,COOPERATIVA DE CRÉDITO CLÁSSICA DOS FUNCIONÁRIOS E PRESTADORES DE SERVIÇOS DAS EMPRESAS LIGADAS AO GRUPO EUCATUR LTDA. - SICOOB EUCRED,Sociedade Cooperativa,,Autorizada em Atividade,false,AVENIDA MARECHAL RONDON  2774,,DOIS DE ABRIL,JI-PARANA,RO,76900864,,,S5,
